Свежие приколы про животных,Свежие приколы про животных,Свежие приколы про животных,Pets,TRUE,F:\Visual Studio\Projects\generatorOfVideoImages\generatorOfVideoImages\bin\Debug\video\Свежие приколы про животных.wmv
Приколы про животных фото видео,Приколы про животных фото видео,Приколы про животных фото видео,Pets,TRUE,F:\Visual Studio\Projects\generatorOfVideoImages\generatorOfVideoImages\bin\Debug\video\Приколы про животных фото видео.wmv
Видео приколы животный,Видео приколы животный,Видео приколы животный,Pets,TRUE,F:\Visual Studio\Projects\generatorOfVideoImages\generatorOfVideoImages\bin\Debug\video\Видео приколы животный.wmv
Прикол про животных,Прикол про животных,Прикол про животных,Pets,TRUE,F:\Visual Studio\Projects\generatorOfVideoImages\generatorOfVideoImages\bin\Debug\video\Прикол про животных.wmv
Прикол животный,Прикол животный,Прикол животный,Pets,TRUE,F:\Visual Studio\Projects\generatorOfVideoImages\generatorOfVideoImages\bin\Debug\video\Прикол животный.wmv
Приколы про животных,Приколы про животных,Приколы про животных,Pets,TRUE,F:\Visual Studio\Projects\generatorOfVideoImages\generatorOfVideoImages\bin\Debug\video\Приколы про животных.wmv
Видео приколы про животных,Видео приколы про животных,Видео приколы про животных,Pets,TRUE,F:\Visual Studio\Projects\generatorOfVideoImages\generatorOfVideoImages\bin\Debug\video\Видео приколы про животных.wmv
Смотреть приколы про животных,Смотреть приколы про животных,Смотреть приколы про животных,Pets,TRUE,F:\Visual Studio\Projects\generatorOfVideoImages\generatorOfVideoImages\bin\Debug\video\Смотреть приколы про животных.wmv
Бесплатные приколы про животных,Бесплатные приколы про животных,Бесплатные приколы про животных,Pets,TRUE,F:\Visual Studio\Projects\generatorOfVideoImages\generatorOfVideoImages\bin\Debug\video\Бесплатные приколы про животных.wmv
Приколы про животных бесплатно,Приколы про животных бесплатно,Приколы про животных бесплатно,Pets,TRUE,F:\Visual Studio\Projects\generatorOfVideoImages\generatorOfVideoImages\bin\Debug\video\Приколы про животных бесплатно.wmv
Ютуб приколы с животными,Ютуб приколы с животными,Ютуб приколы с животными,Pets,TRUE,F:\Visual Studio\Projects\generatorOfVideoImages\generatorOfVideoImages\bin\Debug\video\Ютуб приколы с животными.wmv
Смотреть бесплатные приколы про животных,Смотреть бесплатные приколы про животных,Смотреть бесплатные приколы про животных,Pets,TRUE,F:\Visual Studio\Projects\generatorOfVideoImages\generatorOfVideoImages\bin\Debug\video\Смотреть бесплатные приколы про животных.wmv
Приколы про животных онлайн,Приколы про животных онлайн,Приколы про животных онлайн,Pets,TRUE,F:\Visual Studio\Projects\generatorOfVideoImages\generatorOfVideoImages\bin\Debug\video\Приколы про животных онлайн.wmv
Смотреть видео приколы про животных,Смотреть видео приколы про животных,Смотреть видео приколы про животных,Pets,TRUE,F:\Visual Studio\Projects\generatorOfVideoImages\generatorOfVideoImages\bin\Debug\video\Смотреть видео приколы про животных.wmv
Приколы животных смотреть онлайн бесплатно,Приколы животных смотреть онлайн бесплатно,Приколы животных смотреть онлайн бесплатно,Pets,TRUE,F:\Visual Studio\Projects\generatorOfVideoImages\generatorOfVideoImages\bin\Debug\video\Приколы животных смотреть онлайн бесплатно.wmv
Приколы про животных смотреть онлайн,Приколы про животных смотреть онлайн,Приколы про животных смотреть онлайн,Pets,TRUE,F:\Visual Studio\Projects\generatorOfVideoImages\generatorOfVideoImages\bin\Debug\video\Приколы про животных смотреть онлайн.wmv
Ютуб приколы с животными видео,Ютуб приколы с животными видео,Ютуб приколы с животными видео,Pets,TRUE,F:\Visual Studio\Projects\generatorOfVideoImages\generatorOfVideoImages\bin\Debug\video\Ютуб приколы с животными видео.wmv
Приколы про животных онлайн бесплатно,Приколы про животных онлайн бесплатно,Приколы про животных онлайн бесплатно,Pets,TRUE,F:\Visual Studio\Projects\generatorOfVideoImages\generatorOfVideoImages\bin\Debug\video\Приколы про животных онлайн бесплатно.wmv
Приколы видео животные смотреть бесплатно,Приколы видео животные смотреть бесплатно,Приколы видео животные смотреть бесплатно,Pets,TRUE,F:\Visual Studio\Projects\generatorOfVideoImages\generatorOfVideoImages\bin\Debug\video\Приколы видео животные смотреть бесплатно.wmv
Приколы с животными смотреть бесплатно,Приколы с животными смотреть бесплатно,Приколы с животными смотреть бесплатно,Pets,TRUE,F:\Visual Studio\Projects\generatorOfVideoImages\generatorOfVideoImages\bin\Debug\video\Приколы с животными смотреть бесплатно.wmv
Приколы с животными 2013,Приколы с животными 2013,Приколы с животными 2013,Pets,TRUE,F:\Visual Studio\Projects\generatorOfVideoImages\generatorOfVideoImages\bin\Debug\video\Приколы с животными 2013.wmv
Бесплатные видео приколы про животных,Бесплатные видео приколы про животных,Бесплатные видео приколы про животных,Pets,TRUE,F:\Visual Studio\Projects\generatorOfVideoImages\generatorOfVideoImages\bin\Debug\video\Бесплатные видео приколы про животных.wmv
Приколы видео про животных бесплатно,Приколы видео про животных бесплатно,Приколы видео про животных бесплатно,Pets,TRUE,F:\Visual Studio\Projects\generatorOfVideoImages\generatorOfVideoImages\bin\Debug\video\Приколы видео про животных бесплатно.wmv
Фото приколы про животных,Фото приколы про животных,Фото приколы про животных,Pets,TRUE,F:\Visual Studio\Projects\generatorOfVideoImages\generatorOfVideoImages\bin\Debug\video\Фото приколы про животных.wmv
Видео приколы животные смотреть онлайн,Видео приколы животные смотреть онлайн,Видео приколы животные смотреть онлайн,Pets,TRUE,F:\Visual Studio\Projects\generatorOfVideoImages\generatorOfVideoImages\bin\Debug\video\Видео приколы животные смотреть онлайн.wmv
Смешные приколы про животных,Смешные приколы про животных,Смешные приколы про животных,Pets,TRUE,F:\Visual Studio\Projects\generatorOfVideoImages\generatorOfVideoImages\bin\Debug\video\Смешные приколы про животных.wmv
Приколы про животных картинки,Приколы про животных картинки,Приколы про животных картинки,Pets,TRUE,F:\Visual Studio\Projects\generatorOfVideoImages\generatorOfVideoImages\bin\Debug\video\Приколы про животных картинки.wmv
Видео приколы 2013 про животных,Видео приколы 2013 про животных,Видео приколы 2013 про животных,Pets,TRUE,F:\Visual Studio\Projects\generatorOfVideoImages\generatorOfVideoImages\bin\Debug\video\Видео приколы 2013 про животных.wmv
Онлайн видео приколы про животных,Онлайн видео приколы про животных,Онлайн видео приколы про животных,Pets,TRUE,F:\Visual Studio\Projects\generatorOfVideoImages\generatorOfVideoImages\bin\Debug\video\Онлайн видео приколы про животных.wmv
Приколы с животными и детьми,Приколы с животными и детьми,Приколы с животными и детьми,Pets,TRUE,F:\Visual Studio\Projects\generatorOfVideoImages\generatorOfVideoImages\bin\Debug\video\Приколы с животными и детьми.wmv
Видео приколы животные и дети,Видео приколы животные и дети,Видео приколы животные и дети,Pets,TRUE,F:\Visual Studio\Projects\generatorOfVideoImages\generatorOfVideoImages\bin\Debug\video\Видео приколы животные и дети.wmv
Приколы про животных скачать,Приколы про животных скачать,Приколы про животных скачать,Pets,TRUE,F:\Visual Studio\Projects\generatorOfVideoImages\generatorOfVideoImages\bin\Debug\video\Приколы про животных скачать.wmv
Приколы про животных с надписями,Приколы про животных с надписями,Приколы про животных с надписями,Pets,TRUE,F:\Visual Studio\Projects\generatorOfVideoImages\generatorOfVideoImages\bin\Debug\video\Приколы про животных с надписями.wmv
Фото приколы с животными с надписями,Фото приколы с животными с надписями,Фото приколы с животными с надписями,Pets,TRUE,F:\Visual Studio\Projects\generatorOfVideoImages\generatorOfVideoImages\bin\Debug\video\Фото приколы с животными с надписями.wmv
Лучшие приколы про животных,Лучшие приколы про животных,Лучшие приколы про животных,Pets,TRUE,F:\Visual Studio\Projects\generatorOfVideoImages\generatorOfVideoImages\bin\Debug\video\Лучшие приколы про животных.wmv
Смотреть ютуб приколы про животных,Смотреть ютуб приколы про животных,Смотреть ютуб приколы про животных,Pets,TRUE,F:\Visual Studio\Projects\generatorOfVideoImages\generatorOfVideoImages\bin\Debug\video\Смотреть ютуб приколы про животных.wmv
Смешные приколы про животных видео,Смешные приколы про животных видео,Смешные приколы про животных видео,Pets,TRUE,F:\Visual Studio\Projects\generatorOfVideoImages\generatorOfVideoImages\bin\Debug\video\Смешные приколы про животных видео.wmv
Смотреть приколы про животных 2013,Смотреть приколы про животных 2013,Смотреть приколы про животных 2013,Pets,TRUE,F:\Visual Studio\Projects\generatorOfVideoImages\generatorOfVideoImages\bin\Debug\video\Смотреть приколы про животных 2013.wmv
Смотреть смешные приколы про животных,Смотреть смешные приколы про животных,Смотреть смешные приколы про животных,Pets,TRUE,F:\Visual Studio\Projects\generatorOfVideoImages\generatorOfVideoImages\bin\Debug\video\Смотреть смешные приколы про животных.wmv
Приколы про животных видео скачать,Приколы про животных видео скачать,Приколы про животных видео скачать,Pets,TRUE,F:\Visual Studio\Projects\generatorOfVideoImages\generatorOfVideoImages\bin\Debug\video\Приколы про животных видео скачать.wmv
Самые смешные животные видео приколы,Самые смешные животные видео приколы,Самые смешные животные видео приколы,Pets,TRUE,F:\Visual Studio\Projects\generatorOfVideoImages\generatorOfVideoImages\bin\Debug\video\Самые смешные животные видео приколы.wmv
Картинки приколы животные с надписями,Картинки приколы животные с надписями,Картинки приколы животные с надписями,Pets,TRUE,F:\Visual Studio\Projects\generatorOfVideoImages\generatorOfVideoImages\bin\Debug\video\Картинки приколы животные с надписями.wmv
Игры приколы над животными,Игры приколы над животными,Игры приколы над животными,Pets,TRUE,F:\Visual Studio\Projects\generatorOfVideoImages\generatorOfVideoImages\bin\Debug\video\Игры приколы над животными.wmv
Самые смешные приколы про животных,Самые смешные приколы про животных,Самые смешные приколы про животных,Pets,TRUE,F:\Visual Studio\Projects\generatorOfVideoImages\generatorOfVideoImages\bin\Debug\video\Самые смешные приколы про животных.wmv
Подборка приколов с животными,Подборка приколов с животными,Подборка приколов с животными,Pets,TRUE,F:\Visual Studio\Projects\generatorOfVideoImages\generatorOfVideoImages\bin\Debug\video\Подборка приколов с животными.wmv
Новые приколы про животных,Новые приколы про животных,Новые приколы про животных,Pets,TRUE,F:\Visual Studio\Projects\generatorOfVideoImages\generatorOfVideoImages\bin\Debug\video\Новые приколы про животных.wmv
Приколы про людей и животных,Приколы про людей и животных,Приколы про людей и животных,Pets,TRUE,F:\Visual Studio\Projects\generatorOfVideoImages\generatorOfVideoImages\bin\Debug\video\Приколы про людей и животных.wmv
Приколы с животными 2013 бесплатно,Приколы с животными 2013 бесплатно,Приколы с животными 2013 бесплатно,Pets,TRUE,F:\Visual Studio\Projects\generatorOfVideoImages\generatorOfVideoImages\bin\Debug\video\Приколы с животными 2013 бесплатно.wmv
Посмотреть приколы про животных,Посмотреть приколы про животных,Посмотреть приколы про животных,Pets,TRUE,F:\Visual Studio\Projects\generatorOfVideoImages\generatorOfVideoImages\bin\Debug\video\Посмотреть приколы про животных.wmv
Приколы с животными youtube,Приколы с животными youtube,Приколы с животными youtube,Pets,TRUE,F:\Visual Studio\Projects\generatorOfVideoImages\generatorOfVideoImages\bin\Debug\video\Приколы с животными youtube.wmv
Лучшие приколы с животными видео,Лучшие приколы с животными видео,Лучшие приколы с животными видео,Pets,TRUE,F:\Visual Studio\Projects\generatorOfVideoImages\generatorOfVideoImages\bin\Debug\video\Лучшие приколы с животными видео.wmv
Скачать бесплатно приколы про животных,Скачать бесплатно приколы про животных,Скачать бесплатно приколы про животных,Pets,TRUE,F:\Visual Studio\Projects\generatorOfVideoImages\generatorOfVideoImages\bin\Debug\video\Скачать бесплатно приколы про животных.wmv
Видио приколы животных,Видио приколы животных,Видио приколы животных,Pets,TRUE,F:\Visual Studio\Projects\generatorOfVideoImages\generatorOfVideoImages\bin\Debug\video\Видио приколы животных.wmv
Ютюб приколы с животными,Ютюб приколы с животными,Ютюб приколы с животными,Pets,TRUE,F:\Visual Studio\Projects\generatorOfVideoImages\generatorOfVideoImages\bin\Debug\video\Ютюб приколы с животными.wmv
Приколы торрент про животных,Приколы торрент про животных,Приколы торрент про животных,Pets,TRUE,F:\Visual Studio\Projects\generatorOfVideoImages\generatorOfVideoImages\bin\Debug\video\Приколы торрент про животных.wmv
Ролики приколы про животных,Ролики приколы про животных,Ролики приколы про животных,Pets,TRUE,F:\Visual Studio\Projects\generatorOfVideoImages\generatorOfVideoImages\bin\Debug\video\Ролики приколы про животных.wmv
Видео приколы животные скачать бесплатно,Видео приколы животные скачать бесплатно,Видео приколы животные скачать бесплатно,Pets,TRUE,F:\Visual Studio\Projects\generatorOfVideoImages\generatorOfVideoImages\bin\Debug\video\Видео приколы животные скачать бесплатно.wmv
Приколы про животных скачать торрент,Приколы про животных скачать торрент,Приколы про животных скачать торрент,Pets,TRUE,F:\Visual Studio\Projects\generatorOfVideoImages\generatorOfVideoImages\bin\Debug\video\Приколы про животных скачать торрент.wmv
Игры для девочек животные приколы,Игры для девочек животные приколы,Игры для девочек животные приколы,Pets,TRUE,F:\Visual Studio\Projects\generatorOfVideoImages\generatorOfVideoImages\bin\Debug\video\Игры для девочек животные приколы.wmv
Приколы про животных кошек,Приколы про животных кошек,Приколы про животных кошек,Pets,TRUE,F:\Visual Studio\Projects\generatorOfVideoImages\generatorOfVideoImages\bin\Debug\video\Приколы про животных кошек.wmv
Очень смешные приколы про животных,Очень смешные приколы про животных,Очень смешные приколы про животных,Pets,TRUE,F:\Visual Studio\Projects\generatorOfVideoImages\generatorOfVideoImages\bin\Debug\video\Очень смешные приколы про животных.wmv
О чем думают животные приколы,О чем думают животные приколы,О чем думают животные приколы,Pets,TRUE,F:\Visual Studio\Projects\generatorOfVideoImages\generatorOfVideoImages\bin\Debug\video\О чем думают животные приколы.wmv
Видео про животных приколы торрент,Видео про животных приколы торрент,Видео про животных приколы торрент,Pets,TRUE,F:\Visual Studio\Projects\generatorOfVideoImages\generatorOfVideoImages\bin\Debug\video\Видео про животных приколы торрент.wmv
Как едят животные прикол,Как едят животные прикол,Как едят животные прикол,Pets,TRUE,F:\Visual Studio\Projects\generatorOfVideoImages\generatorOfVideoImages\bin\Debug\video\Как едят животные прикол.wmv
Ржачные приколы про животных,Ржачные приколы про животных,Ржачные приколы про животных,Pets,TRUE,F:\Visual Studio\Projects\generatorOfVideoImages\generatorOfVideoImages\bin\Debug\video\Ржачные приколы про животных.wmv
Подборка приколов 2013 с животными,Подборка приколов 2013 с животными,Подборка приколов 2013 с животными,Pets,TRUE,F:\Visual Studio\Projects\generatorOfVideoImages\generatorOfVideoImages\bin\Debug\video\Подборка приколов 2013 с животными.wmv
Ютуб приколы животные и дети,Ютуб приколы животные и дети,Ютуб приколы животные и дети,Pets,TRUE,F:\Visual Studio\Projects\generatorOfVideoImages\generatorOfVideoImages\bin\Debug\video\Ютуб приколы животные и дети.wmv
Приколы животный мир,Приколы животный мир,Приколы животный мир,Pets,TRUE,F:\Visual Studio\Projects\generatorOfVideoImages\generatorOfVideoImages\bin\Debug\video\Приколы животный мир.wmv
Бесплатно посмотреть приколы про животных,Бесплатно посмотреть приколы про животных,Бесплатно посмотреть приколы про животных,Pets,TRUE,F:\Visual Studio\Projects\generatorOfVideoImages\generatorOfVideoImages\bin\Debug\video\Бесплатно посмотреть приколы про животных.wmv
Ютюб приколы с животными видео,Ютюб приколы с животными видео,Ютюб приколы с животными видео,Pets,TRUE,F:\Visual Studio\Projects\generatorOfVideoImages\generatorOfVideoImages\bin\Debug\video\Ютюб приколы с животными видео.wmv
Фото приколы смешные про животных,Фото приколы смешные про животных,Фото приколы смешные про животных,Pets,TRUE,F:\Visual Studio\Projects\generatorOfVideoImages\generatorOfVideoImages\bin\Debug\video\Фото приколы смешные про животных.wmv
Посмотреть видео приколы про животных,Посмотреть видео приколы про животных,Посмотреть видео приколы про животных,Pets,TRUE,F:\Visual Studio\Projects\generatorOfVideoImages\generatorOfVideoImages\bin\Debug\video\Посмотреть видео приколы про животных.wmv
Пьяные животные видео приколы,Пьяные животные видео приколы,Пьяные животные видео приколы,Pets,TRUE,F:\Visual Studio\Projects\generatorOfVideoImages\generatorOfVideoImages\bin\Debug\video\Пьяные животные видео приколы.wmv
Приколы с домашними животными,Приколы с домашними животными,Приколы с домашними животными,Pets,TRUE,F:\Visual Studio\Projects\generatorOfVideoImages\generatorOfVideoImages\bin\Debug\video\Приколы с домашними животными.wmv
Ю туб приколы с животными,Ю туб приколы с животными,Ю туб приколы с животными,Pets,TRUE,F:\Visual Studio\Projects\generatorOfVideoImages\generatorOfVideoImages\bin\Debug\video\Ю туб приколы с животными.wmv
Приколы с животными коты,Приколы с животными коты,Приколы с животными коты,Pets,TRUE,F:\Visual Studio\Projects\generatorOfVideoImages\generatorOfVideoImages\bin\Debug\video\Приколы с животными коты.wmv
Смотреть фото приколы про животных,Смотреть фото приколы про животных,Смотреть фото приколы про животных,Pets,TRUE,F:\Visual Studio\Projects\generatorOfVideoImages\generatorOfVideoImages\bin\Debug\video\Смотреть фото приколы про животных.wmv
