Рисунки приколы животные,Рисунки приколы животные,Рисунки приколы животные,Pets,TRUE,F:\Visual Studio\Projects\generatorOfVideoImages\generatorOfVideoImages\bin\Debug\video\Рисунки приколы животные.wmv
Картинки про животных приколы бесплатно,Картинки про животных приколы бесплатно,Картинки про животных приколы бесплатно,Pets,TRUE,F:\Visual Studio\Projects\generatorOfVideoImages\generatorOfVideoImages\bin\Debug\video\Картинки про животных приколы бесплатно.wmv
Супер приколы с животными,Супер приколы с животными,Супер приколы с животными,Pets,TRUE,F:\Visual Studio\Projects\generatorOfVideoImages\generatorOfVideoImages\bin\Debug\video\Супер приколы с животными.wmv
Смотреть подборка приколов с животными,Смотреть подборка приколов с животными,Смотреть подборка приколов с животными,Pets,TRUE,F:\Visual Studio\Projects\generatorOfVideoImages\generatorOfVideoImages\bin\Debug\video\Смотреть подборка приколов с животными.wmv
Яндекс видео приколы про животных,Яндекс видео приколы про животных,Яндекс видео приколы про животных,Pets,TRUE,F:\Visual Studio\Projects\generatorOfVideoImages\generatorOfVideoImages\bin\Debug\video\Яндекс видео приколы про животных.wmv
Приколы про животных ржач,Приколы про животных ржач,Приколы про животных ржач,Pets,TRUE,F:\Visual Studio\Projects\generatorOfVideoImages\generatorOfVideoImages\bin\Debug\video\Приколы про животных ржач.wmv
Приколы анекдоты про животных,Приколы анекдоты про животных,Приколы анекдоты про животных,Pets,TRUE,F:\Visual Studio\Projects\generatorOfVideoImages\generatorOfVideoImages\bin\Debug\video\Приколы анекдоты про животных.wmv
Нарезка приколов с животными 2013,Нарезка приколов с животными 2013,Нарезка приколов с животными 2013,Pets,TRUE,F:\Visual Studio\Projects\generatorOfVideoImages\generatorOfVideoImages\bin\Debug\video\Нарезка приколов с животными 2013.wmv
Приколы с участием животных,Приколы с участием животных,Приколы с участием животных,Pets,TRUE,F:\Visual Studio\Projects\generatorOfVideoImages\generatorOfVideoImages\bin\Debug\video\Приколы с участием животных.wmv
Приколы про животных яички,Приколы про животных яички,Приколы про животных яички,Pets,TRUE,F:\Visual Studio\Projects\generatorOfVideoImages\generatorOfVideoImages\bin\Debug\video\Приколы про животных яички.wmv
Видео приколы животный смех,Видео приколы животный смех,Видео приколы животный смех,Pets,TRUE,F:\Visual Studio\Projects\generatorOfVideoImages\generatorOfVideoImages\bin\Debug\video\Видео приколы животный смех.wmv
Приколы с животными коты фото,Приколы с животными коты фото,Приколы с животными коты фото,Pets,TRUE,F:\Visual Studio\Projects\generatorOfVideoImages\generatorOfVideoImages\bin\Debug\video\Приколы с животными коты фото.wmv
Приколы с животными 2013 картинки,Приколы с животными 2013 картинки,Приколы с животными 2013 картинки,Pets,TRUE,F:\Visual Studio\Projects\generatorOfVideoImages\generatorOfVideoImages\bin\Debug\video\Приколы с животными 2013 картинки.wmv
Видео приколы про животных нарезка,Видео приколы про животных нарезка,Видео приколы про животных нарезка,Pets,TRUE,F:\Visual Studio\Projects\generatorOfVideoImages\generatorOfVideoImages\bin\Debug\video\Видео приколы про животных нарезка.wmv
Веселые приколы про животных,Веселые приколы про животных,Веселые приколы про животных,Pets,TRUE,F:\Visual Studio\Projects\generatorOfVideoImages\generatorOfVideoImages\bin\Debug\video\Веселые приколы про животных.wmv
Приколы c животными,Приколы c животными,Приколы c животными,Pets,TRUE,F:\Visual Studio\Projects\generatorOfVideoImages\generatorOfVideoImages\bin\Debug\video\Приколы c животными.wmv
Самые прикольные приколы про животных,Самые прикольные приколы про животных,Самые прикольные приколы про животных,Pets,TRUE,F:\Visual Studio\Projects\generatorOfVideoImages\generatorOfVideoImages\bin\Debug\video\Самые прикольные приколы про животных.wmv
Приколы с малышами и животными,Приколы с малышами и животными,Приколы с малышами и животными,Pets,TRUE,F:\Visual Studio\Projects\generatorOfVideoImages\generatorOfVideoImages\bin\Debug\video\Приколы с малышами и животными.wmv
Дружба между животными прикол,Дружба между животными прикол,Дружба между животными прикол,Pets,TRUE,F:\Visual Studio\Projects\generatorOfVideoImages\generatorOfVideoImages\bin\Debug\video\Дружба между животными прикол.wmv
Игры приколы над животными бесплатно,Игры приколы над животными бесплатно,Игры приколы над животными бесплатно,Pets,TRUE,F:\Visual Studio\Projects\generatorOfVideoImages\generatorOfVideoImages\bin\Debug\video\Игры приколы над животными бесплатно.wmv
Игры приколы издевательства над животными,Игры приколы издевательства над животными,Игры приколы издевательства над животными,Pets,TRUE,F:\Visual Studio\Projects\generatorOfVideoImages\generatorOfVideoImages\bin\Debug\video\Игры приколы издевательства над животными.wmv
Приколы из жизни животных,Приколы из жизни животных,Приколы из жизни животных,Pets,TRUE,F:\Visual Studio\Projects\generatorOfVideoImages\generatorOfVideoImages\bin\Debug\video\Приколы из жизни животных.wmv
Передача приколы про животных,Передача приколы про животных,Передача приколы про животных,Pets,TRUE,F:\Visual Studio\Projects\generatorOfVideoImages\generatorOfVideoImages\bin\Debug\video\Передача приколы про животных.wmv
Приколы пр животных,Приколы пр животных,Приколы пр животных,Pets,TRUE,F:\Visual Studio\Projects\generatorOfVideoImages\generatorOfVideoImages\bin\Debug\video\Приколы пр животных.wmv
Приколы майнкрафт про животных,Приколы майнкрафт про животных,Приколы майнкрафт про животных,Pets,TRUE,F:\Visual Studio\Projects\generatorOfVideoImages\generatorOfVideoImages\bin\Debug\video\Приколы майнкрафт про животных.wmv
Анимационные картинки приколы с животными,Анимационные картинки приколы с животными,Анимационные картинки приколы с животными,Pets,TRUE,F:\Visual Studio\Projects\generatorOfVideoImages\generatorOfVideoImages\bin\Debug\video\Анимационные картинки приколы с животными.wmv
В мире животных видео приколы,В мире животных видео приколы,В мире животных видео приколы,Pets,TRUE,F:\Visual Studio\Projects\generatorOfVideoImages\generatorOfVideoImages\bin\Debug\video\В мире животных видео приколы.wmv
Виде приколы про животных,Виде приколы про животных,Виде приколы про животных,Pets,TRUE,F:\Visual Studio\Projects\generatorOfVideoImages\generatorOfVideoImages\bin\Debug\video\Виде приколы про животных.wmv
Взаимопомощь животных приколы,Взаимопомощь животных приколы,Взаимопомощь животных приколы,Pets,TRUE,F:\Visual Studio\Projects\generatorOfVideoImages\generatorOfVideoImages\bin\Debug\video\Взаимопомощь животных приколы.wmv
Приколы про животных под музыку,Приколы про животных под музыку,Приколы про животных под музыку,Pets,TRUE,F:\Visual Studio\Projects\generatorOfVideoImages\generatorOfVideoImages\bin\Debug\video\Приколы про животных под музыку.wmv
Приколы про мультяшных животных,Приколы про мультяшных животных,Приколы про мультяшных животных,Pets,TRUE,F:\Visual Studio\Projects\generatorOfVideoImages\generatorOfVideoImages\bin\Debug\video\Приколы про мультяшных животных.wmv
Приколы с животными ютуб фото,Приколы с животными ютуб фото,Приколы с животными ютуб фото,Pets,TRUE,F:\Visual Studio\Projects\generatorOfVideoImages\generatorOfVideoImages\bin\Debug\video\Приколы с животными ютуб фото.wmv
Картинки приколы смешные животные анимация,Картинки приколы смешные животные анимация,Картинки приколы смешные животные анимация,Pets,TRUE,F:\Visual Studio\Projects\generatorOfVideoImages\generatorOfVideoImages\bin\Debug\video\Картинки приколы смешные животные анимация.wmv
