Песни приколы про животных,Песни приколы про животных,Песни приколы про животных,Pets,TRUE,F:\Visual Studio\Projects\generatorOfVideoImages\generatorOfVideoImages\bin\Debug\video\Песни приколы про животных.wmv
Новые приколы про животных видео,Новые приколы про животных видео,Новые приколы про животных видео,Pets,TRUE,F:\Visual Studio\Projects\generatorOfVideoImages\generatorOfVideoImages\bin\Debug\video\Новые приколы про животных видео.wmv
Приколы про животных с озвучкой,Приколы про животных с озвучкой,Приколы про животных с озвучкой,Pets,TRUE,F:\Visual Studio\Projects\generatorOfVideoImages\generatorOfVideoImages\bin\Debug\video\Приколы про животных с озвучкой.wmv
Видео приколы кошки и животные,Видео приколы кошки и животные,Видео приколы кошки и животные,Pets,TRUE,F:\Visual Studio\Projects\generatorOfVideoImages\generatorOfVideoImages\bin\Debug\video\Видео приколы кошки и животные.wmv
Приколы с животными видео подборка,Приколы с животными видео подборка,Приколы с животными видео подборка,Pets,TRUE,F:\Visual Studio\Projects\generatorOfVideoImages\generatorOfVideoImages\bin\Debug\video\Приколы с животными видео подборка.wmv
Нарезка приколов про животных,Нарезка приколов про животных,Нарезка приколов про животных,Pets,TRUE,F:\Visual Studio\Projects\generatorOfVideoImages\generatorOfVideoImages\bin\Debug\video\Нарезка приколов про животных.wmv
Фото приколы с животными 2013,Фото приколы с животными 2013,Фото приколы с животными 2013,Pets,TRUE,F:\Visual Studio\Projects\generatorOfVideoImages\generatorOfVideoImages\bin\Debug\video\Фото приколы с животными 2013.wmv
Фото приколы про животных новые,Фото приколы про животных новые,Фото приколы про животных новые,Pets,TRUE,F:\Visual Studio\Projects\generatorOfVideoImages\generatorOfVideoImages\bin\Debug\video\Фото приколы про животных новые.wmv
Фото дети и животные приколы,Фото дети и животные приколы,Фото дети и животные приколы,Pets,TRUE,F:\Visual Studio\Projects\generatorOfVideoImages\generatorOfVideoImages\bin\Debug\video\Фото дети и животные приколы.wmv
Ютуб приколы смешные животные,Ютуб приколы смешные животные,Ютуб приколы смешные животные,Pets,TRUE,F:\Visual Studio\Projects\generatorOfVideoImages\generatorOfVideoImages\bin\Debug\video\Ютуб приколы смешные животные.wmv
Приколы с животными ютуб бесплатно,Приколы с животными ютуб бесплатно,Приколы с животными ютуб бесплатно,Pets,TRUE,F:\Visual Studio\Projects\generatorOfVideoImages\generatorOfVideoImages\bin\Debug\video\Приколы с животными ютуб бесплатно.wmv
Ю туб видео приколы животные,Ю туб видео приколы животные,Ю туб видео приколы животные,Pets,TRUE,F:\Visual Studio\Projects\generatorOfVideoImages\generatorOfVideoImages\bin\Debug\video\Ю туб видео приколы животные.wmv
Youtube видео приколы с животными,Youtube видео приколы с животными,Youtube видео приколы с животными,Pets,TRUE,F:\Visual Studio\Projects\generatorOfVideoImages\generatorOfVideoImages\bin\Debug\video\Youtube видео приколы с животными.wmv
Приколы в мире животных,Приколы в мире животных,Приколы в мире животных,Pets,TRUE,F:\Visual Studio\Projects\generatorOfVideoImages\generatorOfVideoImages\bin\Debug\video\Приколы в мире животных.wmv
Картинки приколы смешные про животных,Картинки приколы смешные про животных,Картинки приколы смешные про животных,Pets,TRUE,F:\Visual Studio\Projects\generatorOfVideoImages\generatorOfVideoImages\bin\Debug\video\Картинки приколы смешные про животных.wmv
Ютуб приколы с животными 2013,Ютуб приколы с животными 2013,Ютуб приколы с животными 2013,Pets,TRUE,F:\Visual Studio\Projects\generatorOfVideoImages\generatorOfVideoImages\bin\Debug\video\Ютуб приколы с животными 2013.wmv
Приколы с дикими животными,Приколы с дикими животными,Приколы с дикими животными,Pets,TRUE,F:\Visual Studio\Projects\generatorOfVideoImages\generatorOfVideoImages\bin\Debug\video\Приколы с дикими животными.wmv
Приколы про животных 2013 года,Приколы про животных 2013 года,Приколы про животных 2013 года,Pets,TRUE,F:\Visual Studio\Projects\generatorOfVideoImages\generatorOfVideoImages\bin\Debug\video\Приколы про животных 2013 года.wmv
Приколы видео русские животные,Приколы видео русские животные,Приколы видео русские животные,Pets,TRUE,F:\Visual Studio\Projects\generatorOfVideoImages\generatorOfVideoImages\bin\Debug\video\Приколы видео русские животные.wmv
Приколы про пьяных животных,Приколы про пьяных животных,Приколы про пьяных животных,Pets,TRUE,F:\Visual Studio\Projects\generatorOfVideoImages\generatorOfVideoImages\bin\Debug\video\Приколы про пьяных животных.wmv
Приколы про животных обезьяны,Приколы про животных обезьяны,Приколы про животных обезьяны,Pets,TRUE,F:\Visual Studio\Projects\generatorOfVideoImages\generatorOfVideoImages\bin\Debug\video\Приколы про животных обезьяны.wmv
Ytube приколы про животных,Ytube приколы про животных,Ytube приколы про животных,Pets,TRUE,F:\Visual Studio\Projects\generatorOfVideoImages\generatorOfVideoImages\bin\Debug\video\Ytube приколы про животных.wmv
Смотреть новые приколы про животных,Смотреть новые приколы про животных,Смотреть новые приколы про животных,Pets,TRUE,F:\Visual Studio\Projects\generatorOfVideoImages\generatorOfVideoImages\bin\Debug\video\Смотреть новые приколы про животных.wmv
Ytube видео приколы про животных,Ytube видео приколы про животных,Ytube видео приколы про животных,Pets,TRUE,F:\Visual Studio\Projects\generatorOfVideoImages\generatorOfVideoImages\bin\Debug\video\Ytube видео приколы про животных.wmv
Приколы про животных стихи,Приколы про животных стихи,Приколы про животных стихи,Pets,TRUE,F:\Visual Studio\Projects\generatorOfVideoImages\generatorOfVideoImages\bin\Debug\video\Приколы про животных стихи.wmv
Русские приколы про животных,Русские приколы про животных,Русские приколы про животных,Pets,TRUE,F:\Visual Studio\Projects\generatorOfVideoImages\generatorOfVideoImages\bin\Debug\video\Русские приколы про животных.wmv
Про животных собак приколы,Про животных собак приколы,Про животных собак приколы,Pets,TRUE,F:\Visual Studio\Projects\generatorOfVideoImages\generatorOfVideoImages\bin\Debug\video\Про животных собак приколы.wmv
Ютьюб приколы с животными,Ютьюб приколы с животными,Ютьюб приколы с животными,Pets,TRUE,F:\Visual Studio\Projects\generatorOfVideoImages\generatorOfVideoImages\bin\Debug\video\Ютьюб приколы с животными.wmv
Новые приколы с животными 2013,Новые приколы с животными 2013,Новые приколы с животными 2013,Pets,TRUE,F:\Visual Studio\Projects\generatorOfVideoImages\generatorOfVideoImages\bin\Debug\video\Новые приколы с животными 2013.wmv
Детские приколы про животных,Детские приколы про животных,Детские приколы про животных,Pets,TRUE,F:\Visual Studio\Projects\generatorOfVideoImages\generatorOfVideoImages\bin\Debug\video\Детские приколы про животных.wmv
Демотиваторы приколы про животных,Демотиваторы приколы про животных,Демотиваторы приколы про животных,Pets,TRUE,F:\Visual Studio\Projects\generatorOfVideoImages\generatorOfVideoImages\bin\Debug\video\Демотиваторы приколы про животных.wmv
Смотреть картинки приколы про животных,Смотреть картинки приколы про животных,Смотреть картинки приколы про животных,Pets,TRUE,F:\Visual Studio\Projects\generatorOfVideoImages\generatorOfVideoImages\bin\Debug\video\Смотреть картинки приколы про животных.wmv
Приколы про животных самые новые,Приколы про животных самые новые,Приколы про животных самые новые,Pets,TRUE,F:\Visual Studio\Projects\generatorOfVideoImages\generatorOfVideoImages\bin\Debug\video\Приколы про животных самые новые.wmv
Ржачные приколы про животных видео,Ржачные приколы про животных видео,Ржачные приколы про животных видео,Pets,TRUE,F:\Visual Studio\Projects\generatorOfVideoImages\generatorOfVideoImages\bin\Debug\video\Ржачные приколы про животных видео.wmv
Самые ржачные приколы про животных,Самые ржачные приколы про животных,Самые ржачные приколы про животных,Pets,TRUE,F:\Visual Studio\Projects\generatorOfVideoImages\generatorOfVideoImages\bin\Debug\video\Самые ржачные приколы про животных.wmv
Скачать картинки приколы про животных,Скачать картинки приколы про животных,Скачать картинки приколы про животных,Pets,TRUE,F:\Visual Studio\Projects\generatorOfVideoImages\generatorOfVideoImages\bin\Debug\video\Скачать картинки приколы про животных.wmv
Видеоролики приколы про животных,Видеоролики приколы про животных,Видеоролики приколы про животных,Pets,TRUE,F:\Visual Studio\Projects\generatorOfVideoImages\generatorOfVideoImages\bin\Debug\video\Видеоролики приколы про животных.wmv
Приколы с домашними животными видео,Приколы с домашними животными видео,Приколы с домашними животными видео,Pets,TRUE,F:\Visual Studio\Projects\generatorOfVideoImages\generatorOfVideoImages\bin\Debug\video\Приколы с домашними животными видео.wmv
Приколы про животных до слёз,Приколы про животных до слёз,Приколы про животных до слёз,Pets,TRUE,F:\Visual Studio\Projects\generatorOfVideoImages\generatorOfVideoImages\bin\Debug\video\Приколы про животных до слёз.wmv
Дружба животных приколы,Дружба животных приколы,Дружба животных приколы,Pets,TRUE,F:\Visual Studio\Projects\generatorOfVideoImages\generatorOfVideoImages\bin\Debug\video\Дружба животных приколы.wmv
Видео прикол как едят животные,Видео прикол как едят животные,Видео прикол как едят животные,Pets,TRUE,F:\Visual Studio\Projects\generatorOfVideoImages\generatorOfVideoImages\bin\Debug\video\Видео прикол как едят животные.wmv
Приколы людей с животными видео,Приколы людей с животными видео,Приколы людей с животными видео,Pets,TRUE,F:\Visual Studio\Projects\generatorOfVideoImages\generatorOfVideoImages\bin\Debug\video\Приколы людей с животными видео.wmv
Приколы с дикими животными видео,Приколы с дикими животными видео,Приколы с дикими животными видео,Pets,TRUE,F:\Visual Studio\Projects\generatorOfVideoImages\generatorOfVideoImages\bin\Debug\video\Приколы с дикими животными видео.wmv
Приколы животные смех,Приколы животные смех,Приколы животные смех,Pets,TRUE,F:\Visual Studio\Projects\generatorOfVideoImages\generatorOfVideoImages\bin\Debug\video\Приколы животные смех.wmv
Приколы животный смех,Приколы животный смех,Приколы животный смех,Pets,TRUE,F:\Visual Studio\Projects\generatorOfVideoImages\generatorOfVideoImages\bin\Debug\video\Приколы животный смех.wmv
Видео приколы говорящие животные,Видео приколы говорящие животные,Видео приколы говорящие животные,Pets,TRUE,F:\Visual Studio\Projects\generatorOfVideoImages\generatorOfVideoImages\bin\Debug\video\Видео приколы говорящие животные.wmv
Приколы про животных читать,Приколы про животных читать,Приколы про животных читать,Pets,TRUE,F:\Visual Studio\Projects\generatorOfVideoImages\generatorOfVideoImages\bin\Debug\video\Приколы про животных читать.wmv
Приколы про животных новинки,Приколы про животных новинки,Приколы про животных новинки,Pets,TRUE,F:\Visual Studio\Projects\generatorOfVideoImages\generatorOfVideoImages\bin\Debug\video\Приколы про животных новинки.wmv
Приколы со животными,Приколы со животными,Приколы со животными,Pets,TRUE,F:\Visual Studio\Projects\generatorOfVideoImages\generatorOfVideoImages\bin\Debug\video\Приколы со животными.wmv
Найти приколы про животных,Найти приколы про животных,Найти приколы про животных,Pets,TRUE,F:\Visual Studio\Projects\generatorOfVideoImages\generatorOfVideoImages\bin\Debug\video\Найти приколы про животных.wmv
Приколы с животными фотки,Приколы с животными фотки,Приколы с животными фотки,Pets,TRUE,F:\Visual Studio\Projects\generatorOfVideoImages\generatorOfVideoImages\bin\Debug\video\Приколы с животными фотки.wmv
Самые лучшие приколы с животными,Самые лучшие приколы с животными,Самые лучшие приколы с животными,Pets,TRUE,F:\Visual Studio\Projects\generatorOfVideoImages\generatorOfVideoImages\bin\Debug\video\Самые лучшие приколы с животными.wmv
Приколы в костюмах животных,Приколы в костюмах животных,Приколы в костюмах животных,Pets,TRUE,F:\Visual Studio\Projects\generatorOfVideoImages\generatorOfVideoImages\bin\Debug\video\Приколы в костюмах животных.wmv
Приколы про животных с музыкой,Приколы про животных с музыкой,Приколы про животных с музыкой,Pets,TRUE,F:\Visual Studio\Projects\generatorOfVideoImages\generatorOfVideoImages\bin\Debug\video\Приколы про животных с музыкой.wmv
Супер приколы видео про животных,Супер приколы видео про животных,Супер приколы видео про животных,Pets,TRUE,F:\Visual Studio\Projects\generatorOfVideoImages\generatorOfVideoImages\bin\Debug\video\Супер приколы видео про животных.wmv
Клипы приколы про животных,Клипы приколы про животных,Клипы приколы про животных,Pets,TRUE,F:\Visual Studio\Projects\generatorOfVideoImages\generatorOfVideoImages\bin\Debug\video\Клипы приколы про животных.wmv
Прикольные приколы про животных,Прикольные приколы про животных,Прикольные приколы про животных,Pets,TRUE,F:\Visual Studio\Projects\generatorOfVideoImages\generatorOfVideoImages\bin\Debug\video\Прикольные приколы про животных.wmv
Смотреть приколы с животными кошками,Смотреть приколы с животными кошками,Смотреть приколы с животными кошками,Pets,TRUE,F:\Visual Studio\Projects\generatorOfVideoImages\generatorOfVideoImages\bin\Debug\video\Смотреть приколы с животными кошками.wmv
Приколы с говорящими животными,Приколы с говорящими животными,Приколы с говорящими животными,Pets,TRUE,F:\Visual Studio\Projects\generatorOfVideoImages\generatorOfVideoImages\bin\Debug\video\Приколы с говорящими животными.wmv
Смотреть приколы про животных пьяных,Смотреть приколы про животных пьяных,Смотреть приколы про животных пьяных,Pets,TRUE,F:\Visual Studio\Projects\generatorOfVideoImages\generatorOfVideoImages\bin\Debug\video\Смотреть приколы про животных пьяных.wmv
Ютьюб видео приколы с животными,Ютьюб видео приколы с животными,Ютьюб видео приколы с животными,Pets,TRUE,F:\Visual Studio\Projects\generatorOfVideoImages\generatorOfVideoImages\bin\Debug\video\Ютьюб видео приколы с животными.wmv
Мультики приколы про животных,Мультики приколы про животных,Мультики приколы про животных,Pets,TRUE,F:\Visual Studio\Projects\generatorOfVideoImages\generatorOfVideoImages\bin\Debug\video\Мультики приколы про животных.wmv
Приколы на перце про животных,Приколы на перце про животных,Приколы на перце про животных,Pets,TRUE,F:\Visual Studio\Projects\generatorOfVideoImages\generatorOfVideoImages\bin\Debug\video\Приколы на перце про животных.wmv
Приколы поющие животные,Приколы поющие животные,Приколы поющие животные,Pets,TRUE,F:\Visual Studio\Projects\generatorOfVideoImages\generatorOfVideoImages\bin\Debug\video\Приколы поющие животные.wmv
Приколы про животных фото бесплатно,Приколы про животных фото бесплатно,Приколы про животных фото бесплатно,Pets,TRUE,F:\Visual Studio\Projects\generatorOfVideoImages\generatorOfVideoImages\bin\Debug\video\Приколы про животных фото бесплатно.wmv
Разные приколы про животных,Разные приколы про животных,Разные приколы про животных,Pets,TRUE,F:\Visual Studio\Projects\generatorOfVideoImages\generatorOfVideoImages\bin\Debug\video\Разные приколы про животных.wmv
Приколы пра животных,Приколы пра животных,Приколы пра животных,Pets,TRUE,F:\Visual Studio\Projects\generatorOfVideoImages\generatorOfVideoImages\bin\Debug\video\Приколы пра животных.wmv
Просмотр приколов про животных,Просмотр приколов про животных,Просмотр приколов про животных,Pets,TRUE,F:\Visual Studio\Projects\generatorOfVideoImages\generatorOfVideoImages\bin\Debug\video\Просмотр приколов про животных.wmv
Приколы про животных попугаев,Приколы про животных попугаев,Приколы про животных попугаев,Pets,TRUE,F:\Visual Studio\Projects\generatorOfVideoImages\generatorOfVideoImages\bin\Debug\video\Приколы про животных попугаев.wmv
Смотреть ржачные приколы про животных,Смотреть ржачные приколы про животных,Смотреть ржачные приколы про животных,Pets,TRUE,F:\Visual Studio\Projects\generatorOfVideoImages\generatorOfVideoImages\bin\Debug\video\Смотреть ржачные приколы про животных.wmv
Сборник приколов про животных,Сборник приколов про животных,Сборник приколов про животных,Pets,TRUE,F:\Visual Studio\Projects\generatorOfVideoImages\generatorOfVideoImages\bin\Debug\video\Сборник приколов про животных.wmv
Приколы забавные животные,Приколы забавные животные,Приколы забавные животные,Pets,TRUE,F:\Visual Studio\Projects\generatorOfVideoImages\generatorOfVideoImages\bin\Debug\video\Приколы забавные животные.wmv
Www youtube com приколы животных,Www youtube com приколы животных,Www youtube com приколы животных,Pets,TRUE,F:\Visual Studio\Projects\generatorOfVideoImages\generatorOfVideoImages\bin\Debug\video\Www youtube com приколы животных.wmv
Приколы про животных играть,Приколы про животных играть,Приколы про животных играть,Pets,TRUE,F:\Visual Studio\Projects\generatorOfVideoImages\generatorOfVideoImages\bin\Debug\video\Приколы про животных играть.wmv
Фотографии животных приколы,Фотографии животных приколы,Фотографии животных приколы,Pets,TRUE,F:\Visual Studio\Projects\generatorOfVideoImages\generatorOfVideoImages\bin\Debug\video\Фотографии животных приколы.wmv
Ютюб приколы смотреть про животных,Ютюб приколы смотреть про животных,Ютюб приколы смотреть про животных,Pets,TRUE,F:\Visual Studio\Projects\generatorOfVideoImages\generatorOfVideoImages\bin\Debug\video\Ютюб приколы смотреть про животных.wmv
Смотреть нарезки приколов про животных,Смотреть нарезки приколов про животных,Смотреть нарезки приколов про животных,Pets,TRUE,F:\Visual Studio\Projects\generatorOfVideoImages\generatorOfVideoImages\bin\Debug\video\Смотреть нарезки приколов про животных.wmv
Ю тюб приколы с животными,Ю тюб приколы с животными,Ю тюб приколы с животными,Pets,TRUE,F:\Visual Studio\Projects\generatorOfVideoImages\generatorOfVideoImages\bin\Debug\video\Ю тюб приколы с животными.wmv
Приколы с животными 2012,Приколы с животными 2012,Приколы с животными 2012,Pets,TRUE,F:\Visual Studio\Projects\generatorOfVideoImages\generatorOfVideoImages\bin\Debug\video\Приколы с животными 2012.wmv
